score_name,previous_scaling,scaling_method,scale_version,comparability_tag,comparability_policy,window_comparison_allowed,drift_risk_before,drift_risk_after
equipment_energy_anomaly_score,local_minmax_per_run,anchored_reference_linear,anchored_reference_v1,absolute_comparable_inter_release,comparable entre releases cuando se mantiene scale_version,1,high_under_local_minmax,reduced_with_anchored_reference
process_deviation_risk_score,local_minmax_per_run,anchored_reference_linear,anchored_reference_v1,absolute_comparable_inter_release,comparable entre releases cuando se mantiene scale_version,1,high_under_local_minmax,reduced_with_anchored_reference
line_criticality_score,local_minmax_per_run,anchored_reference_linear,anchored_reference_v1,contextual_comparable_inter_release,comparable por contexto operativo similar; evitar comparar periodos con mix extremo distinto,1,high_under_local_minmax,reduced_with_anchored_reference
opportunity_priority_score,local_minmax_per_run,anchored_reference_linear,anchored_reference_v1,contextual_comparable_inter_release,comparable para priorización táctica; no usar como benchmark absoluto cross-site,1,high_under_local_minmax,reduced_with_anchored_reference
improvement_priority_index,mixed_local_minmax_components,anchored_reference_linear,anchored_reference_v1,contextual_comparable_inter_release,comparable entre releases con misma taxonomía de inputs y versionado estable,1,high_under_local_minmax,reduced_with_anchored_reference
portfolio_objective_score,mixed_local_minmax_components,anchored_reference_linear,anchored_reference_v1,contextual_comparable_inter_release,comparable para decisiones de cartera en mismo marco financiero y restricciones,1,high_under_local_minmax,reduced_with_anchored_reference
